[
  {
    "event_id": "11111111-1111-4111-8111-111111111111",
    "session_id": "demo-session-001",
    "sequence": 1,
    "type": "session.created@v1",
    "occurred_at": "2026-01-01T00:00:00Z",
    "world": { "id": "kane-pixels-backrooms", "version": "0.1.0" },
    "payload": { "participant_ids": ["explorer-01"] }
  },
  {
    "event_id": "22222222-2222-4222-8222-222222222222",
    "session_id": "demo-session-001",
    "sequence": 2,
    "type": "observation.recorded@v1",
    "occurred_at": "2026-01-01T00:01:00Z",
    "actor_id": "explorer-01",
    "causation_id": "33333333-3333-4333-8333-333333333333",
    "world": { "id": "kane-pixels-backrooms", "version": "0.1.0" },
    "payload": { "fact_id": "ambient-light-01", "claim": "A steady electrical hum is audible.", "status": "observed" }
  }
]
